{
  "$schema": "./portfolio.schema.json",
  "site": {
    "title": "Yalla Dhattatreya | AI Engineer",
    "description": "Yalla Dhattatreya, AI Engineer and Electronics and Communication Engineering graduate. Explore projects in Python, computer vision, and embedded systems.",
    "url": "https://yvenkataramamanikanta09-ux.github.io/websiteyalla/",
    "language": "en",
    "themeColor": "#c63318",
    "defaultTheme": "system"
  },
  "profile": {
    "name": "Yalla Dhattatreya",
    "headline": "AI Engineer",
    "introduction": "I build Python applications and real-time solutions across computer vision, web development, and embedded systems.",
    "biography": "I’m an aspiring AI Engineer and Python Developer with a B.Tech in Electronics and Communication Engineering from Srinivasa Institute of Engineering and Technology. I have hands-on project experience in Python, SQL, machine learning, and computer vision through projects such as a Sign Language Communication System and Brain Tumor Detection. I’m expanding my skills in backend development, AWS, and AI/LLM applications, with a focus on solving practical problems. As a recent graduate, I’m seeking an entry-level opportunity to contribute to meaningful projects and grow in AI and software development.",
    "location": "Hyderabad, India",
    "availability": "Open to relevant opportunities",
    "photo": "",
    "photoAlt": "",
    "languages": ["English", "Telugu", "Hindi"],
    "interests": ["Video editing", "Playing sports", "Exploring technology", "Coding practice"]
  },
  "contact": {
    "email": "",
    "links": [
      { "id": "linkedin", "label": "LinkedIn", "url": "https://www.linkedin.com/in/yalla-dhattatreya-9174a0293", "order": 1, "visible": true },
      { "id": "instagram", "label": "Instagram", "url": "https://www.instagram.com/yalladhattatreya/", "order": 2, "visible": true },
      { "id": "github", "label": "GitHub", "url": "https://github.com/yvenkataramamanikanta09-ux", "order": 3, "visible": true },
      { "id": "hackerrank", "label": "HackerRank", "url": "https://www.hackerrank.com/profile/yvenkataramaman1", "order": 4, "visible": true },
      { "id": "leetcode", "label": "LeetCode", "url": "https://leetcode.com/u/dhattatreyayalla_2004/", "order": 5, "visible": true }
    ]
  },
  "resume": { "file": "", "label": "Résumé", "visible": false },
  "labels": {
    "navLabel": "Primary navigation",
    "about": "About",
    "languages": "Languages",
    "interests": "Beyond work",
    "skills": "Skills",
    "experience": "Experience",
    "education": "Education",
    "projects": "Selected work",
    "certifications": "Certifications",
    "contact": "Let’s connect",
    "searchProjects": "Search projects",
    "allCategories": "All categories",
    "viewDetails": "View details",
    "viewCode": "View code",
    "view": "View",
    "download": "Download",
    "verify": "Verify credential"
  },
  "sectionOrder": ["about", "skills", "experience", "education", "projects", "certifications", "contact"],
  "sectionVisibility": {
    "about": true,
    "skills": true,
    "experience": false,
    "education": true,
    "projects": true,
    "certifications": true,
    "contact": true
  },
  "skills": [
    { "id": "programming", "category": "Programming", "items": ["Python", "C", "SQL"], "order": 1, "visible": true },
    { "id": "computer-vision", "category": "Computer Vision", "items": ["OpenCV", "Image processing", "Machine learning", "Real-time gesture recognition"], "order": 2, "visible": true },
    { "id": "web-development", "category": "Web Development", "items": ["HTML", "CSS", "JavaScript", "REST APIs"], "order": 3, "visible": true },
    { "id": "cloud", "category": "Cloud", "items": ["AWS EC2", "AWS Lambda", "AWS VPC", "AWS SQS"], "order": 4, "visible": true },
    { "id": "development-tools", "category": "Development Tools", "items": ["Visual Studio Code", "PyCharm", "Jupyter Notebook", "Git"], "order": 5, "visible": true },
    { "id": "embedded-systems", "category": "Embedded Systems", "items": ["Arduino", "Embedded C", "Ultrasonic sensors", "Sensor interfacing"], "order": 6, "visible": true }
  ],
  "experience": [],
  "education": [
    { "id": "btech-ece", "institution": "Srinivasa Institute of Engineering and Technology, Amalapuram", "qualification": "B.Tech in Electronics and Communication Engineering", "startDate": "2022", "endDate": "2026", "details": "", "order": 1, "visible": true },
    { "id": "intermediate", "institution": "Trimula Junior College, Visakhapatnam", "qualification": "Intermediate", "startDate": "2020", "endDate": "2022", "details": "", "order": 2, "visible": true },
    { "id": "secondary-school", "institution": "Trimula High School, Visakhapatnam", "qualification": "Secondary School", "startDate": "2019", "endDate": "2020", "details": "", "order": 3, "visible": true }
  ],
  "projects": [
    {
      "id": "arduino-radar-system",
      "title": "Arduino-Based Radar System",
      "summary": "Built an Arduino radar system that detects nearby objects with ultrasonic sensors and displays their position in real time.",
      "description": "An embedded system combining Arduino, ultrasonic sensing, and real-time visualization for obstacle detection and monitoring.",
      "problem": "Detect nearby objects and present their positions as sensor readings arrive.",
      "approach": "Interfaced ultrasonic sensors with Arduino, processed readings in Embedded C, and visualized detected objects in real time.",
      "features": ["Nearby object detection", "Real-time position display", "Sensor data processing"],
      "technologies": ["Arduino", "Embedded C", "Ultrasonic Sensors"],
      "contribution": "Developed the sensor interfacing, data processing, and real-time visualization.",
      "outcome": "Demonstrated end-to-end hardware and software integration for obstacle monitoring.",
      "thumbnail": "",
      "thumbnailAlt": "",
      "screenshots": [],
      "repositoryUrl": "",
      "demoUrl": "",
      "reportFile": "",
      "category": "Embedded Systems",
      "tags": ["Arduino", "Sensors", "Real-time"],
      "featured": true,
      "order": 1,
      "visible": true
    },
    {
      "id": "sign-language-communication-system",
      "title": "Sign Language Communication System",
      "summary": "Developed a Python and OpenCV system that recognizes sign-language gestures and converts them into text or speech.",
      "description": "An assistive communication system using image processing and machine-learning techniques for real-time gesture recognition.",
      "problem": "Support communication between people who sign and people who do not sign.",
      "approach": "Used Python, OpenCV, image processing, and machine-learning techniques to recognize gestures in real time.",
      "features": ["Real-time gesture recognition", "Text or speech output", "Assistive communication"],
      "technologies": ["Python", "OpenCV", "TensorFlow", "Keras", "NumPy", "pyttsx3"],
      "contribution": "Developed the gesture recognition system and its text or speech output flow.",
      "outcome": "Converted recognized gestures into text or speech to support communication.",
      "thumbnail": "",
      "thumbnailAlt": "",
      "screenshots": [],
      "repositoryUrl": "https://github.com/yvenkataramamanikanta09-ux/websiteyalla/tree/main/projects/sign-language-communication-system",
      "demoUrl": "",
      "reportFile": "",
      "category": "Computer Vision",
      "tags": ["Python", "OpenCV", "Accessibility"],
      "featured": true,
      "order": 2,
      "visible": true
    }
  ],
  "certifications": [
    { "id": "aws-cloud-practitioner-essentials", "title": "AWS Cloud Practitioner Essentials", "issuer": "", "issueDate": "", "category": "Cloud", "skills": [], "certificateFile": "", "verificationUrl": "", "order": 1, "visible": true },
    { "id": "python-programming", "title": "Python Programming", "issuer": "", "issueDate": "", "category": "Programming", "skills": [], "certificateFile": "", "verificationUrl": "", "order": 2, "visible": true },
    { "id": "embedded-systems-fundamentals", "title": "Embedded Systems Fundamentals", "issuer": "", "issueDate": "", "category": "Embedded Systems", "skills": [], "certificateFile": "", "verificationUrl": "", "order": 3, "visible": true },
    { "id": "web-development-basics", "title": "Web Development Basics", "issuer": "", "issueDate": "", "category": "Web Development", "skills": [], "certificateFile": "", "verificationUrl": "", "order": 4, "visible": true }
  ]
}
